{
  "$schema": "../../schemas/support-matrix.schema.json",
  "version": "1.3.0",
  "updatedAt": "2026-03-08",
  "resolutionPolicy": {
    "precedence": "per_resource_kind_scope_order_then_candidate_priority",
    "tieBreaker": "more_specific_os_match_then_lexicographic_path",
    "fallbackStrategy": "continue_to_next_candidate_until_exhausted"
  },
  "clients": [
    {
      "id": "claude_code",
      "displayName": "Claude Code",
      "category": "cli",
      "binaryCandidates": [
        {
          "priority": 1,
          "command": "claude",
          "role": "happy_path"
        },
        {
          "priority": 2,
          "command": "claude-code",
          "role": "fallback"
        }
      ],
      "configPathCandidates": [
        {
          "kind": "mcp_config",
          "priority": 1,
          "os": [
            "darwin",
            "linux",
            "win32"
          ],
          "path": "${AI_MANAGER_CLAUDE_CODE_MCP_CONFIG}",
          "role": "happy_path"
        },
        {
          "kind": "mcp_config",
          "priority": 2,
          "os": [
            "darwin",
            "linux"
          ],
          "path": "~/.claude.json",
          "role": "fallback"
        },
        {
          "kind": "mcp_config",
          "priority": 3,
          "os": [
            "win32"
          ],
          "path": "%USERPROFILE%/.claude.json",
          "role": "fallback"
        },
        {
          "kind": "mcp_config",
          "priority": 4,
          "os": [
            "darwin",
            "linux",
            "win32"
          ],
          "path": "~/.claude/claude_code_config.json",
          "role": "fallback"
        },
        {
          "kind": "skills_dir",
          "priority": 1,
          "os": [
            "darwin",
            "linux",
            "win32"
          ],
          "path": "${AI_MANAGER_CLAUDE_CODE_SKILLS_DIR}",
          "role": "happy_path"
        },
        {
          "kind": "skills_dir",
          "priority": 2,
          "os": [
            "darwin",
            "linux"
          ],
          "path": "~/.claude/skills",
          "role": "fallback"
        },
        {
          "kind": "skills_dir",
          "priority": 3,
          "os": [
            "win32"
          ],
          "path": "%USERPROFILE%/.claude/skills",
          "role": "fallback"
        }
      ],
      "resourceKinds": {
        "mcp": {
          "currentSourceScopes": [
            "user"
          ],
          "targetSourceScopes": [
            "user",
            "project_shared",
            "project_private"
          ],
          "currentDestinationScopes": [
            "user"
          ],
          "targetDestinationScopes": [
            "user",
            "project_shared",
            "project_private"
          ],
          "effectivePrecedence": [
            "project_private",
            "project_shared",
            "user"
          ],
          "projectScopeStatus": "planned",
          "notes": [
            "Project-shared MCP is sourced from {projectRoot}/.mcp.json.",
            "Project-private MCP is sourced from ~/.claude.json under projects[{canonicalProjectRoot}].mcpServers."
          ]
        },
        "skills": {
          "currentSourceScopes": [
            "user"
          ],
          "targetSourceScopes": [
            "user"
          ],
          "currentDestinationScopes": [
            "user"
          ],
          "targetDestinationScopes": [
            "user"
          ],
          "effectivePrecedence": [
            "user"
          ],
          "projectScopeStatus": "deferred",
          "notes": [
            "This entry describes AI Manager-managed generic SKILL.md repositories only.",
            "Claude project-scoped customization belongs to native subagents/agents and should not extend the generic skill resource kind."
          ]
        },
        "subagents": {
          "currentSourceScopes": [
            "user",
            "project_shared"
          ],
          "targetSourceScopes": [
            "user",
            "project_shared"
          ],
          "currentDestinationScopes": [],
          "targetDestinationScopes": [
            "user",
            "project_shared"
          ],
          "effectivePrecedence": [
            "project_shared",
            "user"
          ],
          "projectScopeStatus": "planned",
          "notes": [
            "Claude native subagents are sourced from ~/.claude/agents and {projectRoot}/.claude/agents.",
            "Subagents are tracked separately from generic skills; mutation flows remain staged."
          ]
        }
      },
      "detectionEvidenceRequirements": [
        "binary_resolves",
        "mcp_config_readable",
        "skills_dir_accessible"
      ],
      "assumptions": [
        "Environment override paths take precedence over default paths.",
        "Detected status requires a successful CLI startup probe (`--version` exits with status 0) in the login-shell environment."
      ]
    },
    {
      "id": "codex",
      "displayName": "Codex",
      "category": "desktop",
      "binaryCandidates": [
        {
          "priority": 1,
          "command": "codex",
          "role": "happy_path"
        },
        {
          "priority": 2,
          "command": "codex-cli",
          "role": "fallback"
        }
      ],
      "configPathCandidates": [
        {
          "kind": "mcp_config",
          "priority": 1,
          "os": [
            "darwin",
            "linux",
            "win32"
          ],
          "path": "${AI_MANAGER_CODEX_MCP_CONFIG}",
          "role": "happy_path"
        },
        {
          "kind": "mcp_config",
          "priority": 2,
          "os": [
            "darwin",
            "linux"
          ],
          "path": "~/.codex/config.toml",
          "role": "fallback"
        },
        {
          "kind": "mcp_config",
          "priority": 3,
          "os": [
            "win32"
          ],
          "path": "%USERPROFILE%/.codex/config.toml",
          "role": "fallback"
        },
        {
          "kind": "skills_dir",
          "priority": 1,
          "os": [
            "darwin",
            "linux",
            "win32"
          ],
          "path": "${AI_MANAGER_CODEX_SKILLS_DIR}",
          "role": "happy_path"
        },
        {
          "kind": "skills_dir",
          "priority": 2,
          "os": [
            "darwin",
            "linux"
          ],
          "path": "~/.codex/skills",
          "role": "fallback"
        },
        {
          "kind": "skills_dir",
          "priority": 3,
          "os": [
            "win32"
          ],
          "path": "%USERPROFILE%/.codex/skills",
          "role": "fallback"
        }
      ],
      "resourceKinds": {
        "mcp": {
          "currentSourceScopes": [
            "user"
          ],
          "targetSourceScopes": [
            "user"
          ],
          "currentDestinationScopes": [
            "user"
          ],
          "targetDestinationScopes": [
            "user"
          ],
          "effectivePrecedence": [
            "user"
          ],
          "projectScopeStatus": "not_applicable",
          "notes": [
            "Codex remains user-only until official upstream project-local MCP support exists."
          ]
        },
        "skills": {
          "currentSourceScopes": [
            "user"
          ],
          "targetSourceScopes": [
            "user"
          ],
          "currentDestinationScopes": [
            "user"
          ],
          "targetDestinationScopes": [
            "user"
          ],
          "effectivePrecedence": [
            "user"
          ],
          "projectScopeStatus": "deferred",
          "notes": [
            "This entry describes AI Manager-managed generic SKILL.md repositories only.",
            "No native project-scoped skills source is documented for Codex. Generic repository handling remains separate from native support."
          ]
        },
        "subagents": {
          "currentSourceScopes": [],
          "targetSourceScopes": [],
          "currentDestinationScopes": [],
          "targetDestinationScopes": [],
          "effectivePrecedence": [],
          "projectScopeStatus": "not_applicable",
          "notes": [
            "Codex has no documented native subagent or agent-manifest source comparable to Claude Code."
          ]
        }
      },
      "detectionEvidenceRequirements": [
        "app_install_present",
        "mcp_config_readable",
        "skills_dir_accessible"
      ],
      "assumptions": [
        "TOML config path should be preferred when both JSON and TOML exist.",
        "Detected status requires Codex app installation evidence; CLI detection is secondary diagnostics only."
      ]
    },
    {
      "id": "cursor",
      "displayName": "Cursor",
      "category": "desktop",
      "binaryCandidates": [
        {
          "priority": 1,
          "command": "cursor",
          "role": "happy_path"
        },
        {
          "priority": 2,
          "command": "Cursor",
          "role": "fallback"
        }
      ],
      "configPathCandidates": [
        {
          "kind": "mcp_config",
          "priority": 1,
          "os": [
            "darwin",
            "linux",
            "win32"
          ],
          "path": "${AI_MANAGER_CURSOR_MCP_CONFIG}",
          "role": "happy_path"
        },
        {
          "kind": "mcp_config",
          "priority": 2,
          "os": [
            "darwin",
            "linux"
          ],
          "path": "~/.cursor/mcp.json",
          "role": "fallback"
        },
        {
          "kind": "mcp_config",
          "priority": 3,
          "os": [
            "darwin"
          ],
          "path": "~/Library/Application Support/Cursor/User/mcp.json",
          "role": "fallback"
        },
        {
          "kind": "mcp_config",
          "priority": 4,